{
  "schema_version": "1.0.0",
  "run_id": "run:10d1c56e-9e36-4a1e-9ca4-c9a4f26b787e",
  "run_name": "protected-cohort-smoke",
  "workflow_type": "imaging",
  "status": "completed",
  "created_at": "2026-09-08T15:00:00Z",
  "updated_at": "2026-09-08T15:02:30Z",
  "completed_at": "2026-09-08T15:02:30Z",
  "code": {
    "git_commit": "aaaaaaaaaaaaaaaaaaaaaaaaaaaaaaaaaaaaaaaa",
    "dirty": false,
    "diff_sha256": null,
    "entry_point": "prowl workflow run protected-cohort-smoke",
    "component_version": "0.1.0"
  },
  "environment": {
    "python": "3.12.11",
    "platform": "macOS arm64",
    "device": "mps",
    "dependencies_sha256": "bbbbbbbbbbbbbbbbbbbbbbbbbbbbbbbbbbbbbbbbbbbbbbbbbbbbbbbbbbbbbbbb",
    "environment_uri": "environment.json"
  },
  "resolved_config": {
    "uri": "resolved-config.yaml",
    "content_sha256": "cccccccccccccccccccccccccccccccccccccccccccccccccccccccccccccccc"
  },
  "source_artifacts": [
    {
      "artifact_id": "snapshot:pants:123456789abc",
      "artifact_type": "source_snapshot",
      "schema_version": "1.0.0",
      "uri": "sources/pants/snapshot-pants-123456789abc/source.json",
      "content_sha256": "dddddddddddddddddddddddddddddddddddddddddddddddddddddddddddddddd",
      "derivation_sha256": "eeeeeeeeeeeeeeeeeeeeeeeeeeeeeeeeeeeeeeeeeeeeeeeeeeeeeeeeeeeeeeee",
      "bytes": 2048
    }
  ],
  "stages": [
    {
      "stage_id": "build_manifest",
      "component_version": "1.0.0",
      "status": "completed",
      "attempt": 1,
      "relevant_config_sha256": "ffffffffffffffffffffffffffffffffffffffffffffffffffffffffffffffff",
      "derivation_sha256": "1111111111111111111111111111111111111111111111111111111111111111",
      "started_at": "2026-09-08T15:00:05Z",
      "completed_at": "2026-09-08T15:02:25Z",
      "duration_seconds": 140.0,
      "inputs": [
        {
          "artifact_id": "snapshot:pants:123456789abc",
          "artifact_type": "source_snapshot",
          "schema_version": "1.0.0",
          "uri": "sources/pants/snapshot-pants-123456789abc/source.json",
          "content_sha256": "dddddddddddddddddddddddddddddddddddddddddddddddddddddddddddddddd",
          "derivation_sha256": "eeeeeeeeeeeeeeeeeeeeeeeeeeeeeeeeeeeeeeeeeeeeeeeeeeeeeeeeeeeeeeee",
          "bytes": 2048
        }
      ],
      "outputs": [
        {
          "artifact_id": "manifest:unified:222222222222",
          "artifact_type": "unified_manifest",
          "schema_version": "1.0.0",
          "uri": "manifests/manifest-unified-222222222222/manifest.json",
          "content_sha256": "3333333333333333333333333333333333333333333333333333333333333333",
          "derivation_sha256": "1111111111111111111111111111111111111111111111111111111111111111",
          "bytes": 4096
        }
      ],
      "error": null
    }
  ],
  "notes": "Synthetic contract example; hashes do not represent project artifacts."
}
